{
  "contract_version": "4.0.0",
  "run_id": "teste-codex-i20-2026-09",
  "project": "Teste sintético i20",
  "filter": "nova busca i20",
  "period": {
    "start": "2026-08-30",
    "end": "2026-08-31",
    "timezone": "America/Sao_Paulo"
  },
  "status": "completed",
  "stage": "complete",
  "paths": {
    "input": "input/stilingue.csv",
    "coverage": "coverage/records.jsonl",
    "analysis": "analysis/records.jsonl",
    "aggregates": "analysis/aggregates.json",
    "evidence": "analysis/evidence-approved.jsonl",
    "report": "deliverables/report.html",
    "report_template": "templates/report-template.html",
    "analytics_template": "templates/analytics-template.xlsx",
    "workbook": "deliverables/analytics.xlsx"
  },
  "template_version": "0.4.0",
  "hashes": {
    "report_template": "aaaaaaaaaaaaaaaaaaaaaaaaaaaaaaaaaaaaaaaaaaaaaaaaaaaaaaaaaaaaaaaa",
    "analytics_template": "bbbbbbbbbbbbbbbbbbbbbbbbbbbbbbbbbbbbbbbbbbbbbbbbbbbbbbbbbbbbbbbb",
    "report": "cccccccccccccccccccccccccccccccccccccccccccccccccccccccccccccccc",
    "analytics": "dddddddddddddddddddddddddddddddddddddddddddddddddddddddddddddddd"
  },
  "counts": {
    "publications": 6,
    "mentions": 5,
    "comments": 7,
    "replies": 1,
    "observed_records": 13,
    "relevant_records": 12,
    "evidence": 5
  },
  "gaps": [
    "Uma rede fora da matriz analítica foi contabilizada como não suportada."
  ],
  "updated_at": "2026-09-09T12:30:00-03:00"
}
